{
  "version": "episode_plan.v1",
  "plan_id": "daily-2026-02-14-001",
  "created_at": "2026-02-14T08:15:00Z",
  "source": "planner",
  "date": "2026-02-14",
  "lanes": {
    "a": 0,
    "b": 1,
    "c": 2
  },
  "theme": "office cats",
  "heroes": [
    "tiger",
    "miso"
  ],
  "beats": [
    {
      "beat_id": "setup",
      "summary": {
        "en": "Tiger tries to look professional during a standup.",
        "zh-Hans": "Tiger 在站会中努力保持专业。"
      }
    },
    {
      "beat_id": "gag",
      "summary": {
        "en": "A latte spill turns into a chaos chain reaction.",
        "zh-Hans": "拿铁洒出引发连锁混乱。"
      }
    },
    {
      "beat_id": "payoff",
      "summary": {
        "en": "Miso saves the day with a perfect deploy.",
        "zh-Hans": "Miso 完美部署拯救现场。"
      }
    }
  ],
  "captions_intent": {
    "en": [
      "Standup starts strong...",
      "Then the latte attacks.",
      "Miso saves the deploy."
    ],
    "zh-Hans": [
      "站会开局很稳...",
      "结果拿铁开战。",
      "Miso 解决部署。"
    ]
  },
  "render_intent": {
    "duration_seconds": 15,
    "aspect_ratio": "9:16",
    "fps": 30,
    "resolution": "1080x1920"
  },
  "languages_enabled": [
    "en",
    "zh-Hans"
  ],
  "creativity": {
    "mode": "balanced",
    "canon_fidelity": "medium"
  },
  "notes": "Keep the humor workplace-safe and emphasize slapstick."
}
